{
  "_comment": "Schema example for /api/evidence.json. The real file is generated at runtime by scripts/gen-evidence.sh and is gitignored. This example documents the expected shape and field types.",
  "schema_version": 1,
  "brand": "Freedom Yield",
  "network": "metal-mainnet",
  "node_id": "NodeID-yyPvtQHTA4FZU5cJtjWZa7RVBpWU3i5v",
  "validator_status": "active",
  "self_stake_metal": null,
  "delegation_fee_percent": null,
  "public_pages": {
    "status": "https://metal.freedom-yield.com/",
    "journal": "https://metal.freedom-yield.com/journal/",
    "incidents": "https://metal.freedom-yield.com/incidents/",
    "commitments": "https://metal.freedom-yield.com/commitments/",
    "risk_disclosure": "https://metal.freedom-yield.com/risk-disclosure/",
    "jurisdiction": "https://metal.freedom-yield.com/jurisdiction/",
    "continuity": "https://metal.freedom-yield.com/continuity/",
    "network": "https://metal.freedom-yield.com/network/",
    "selection_evidence": "https://metal.freedom-yield.com/selection-evidence/",
    "subnet_readiness": "https://metal.freedom-yield.com/subnet-readiness/",
    "reference_architecture": "https://metal.freedom-yield.com/reference-architecture/",
    "subnet_pilot": "https://metal.freedom-yield.com/subnet-pilot/",
    "inquiry": "https://metal.freedom-yield.com/inquiry/",
    "pledge": "https://metal.freedom-yield.com/pledge/",
    "data_catalog": "https://metal.freedom-yield.com/data/"
  },
  "operator_commitments": {
    "non_custodial": true,
    "renewal_transparency": true,
    "decommission_notice_days": 90,
    "incident_disclosure_sla_hours": 24,
    "incident_sla": {
      "detect_minutes_max": 30,
      "acknowledge_hours_business": 2,
      "acknowledge_hours_offhours": 8,
      "status_update_cadence_hours": 4,
      "resolve_or_escalate_hours": 24
    }
  },
  "live_artifacts": {
    "identity_manifest": {
      "url": "https://metal.freedom-yield.com/api/identity.json",
      "signature_url": "https://metal.freedom-yield.com/api/identity.json.sig",
      "pubkey_url": "https://metal.freedom-yield.com/.well-known/operator-identity.pub",
      "pq_signature_url": "https://metal.freedom-yield.com/api/identity.json.mldsa65.sig",
      "pq_pubkey_url": "https://metal.freedom-yield.com/.well-known/operator-identity-mldsa65.pub",
      "schema_url": "https://metal.freedom-yield.com/api/identity.example.json",
      "formal_schema_url": "https://metal.freedom-yield.com/api/identity.schema.v2.json",
      "format_guide_url": "https://github.com/freedomyield/metal.freedom-yield.com/blob/main/docs/IDENTITY_VERIFICATION.md",
      "operator_guide_url": "https://github.com/freedomyield/metal.freedom-yield.com/blob/main/docs/OPERATOR_IDENTITY_SETUP.md",
      "cross_reference_url": "https://metal.freedom-yield.com/api/anchor-source.json"
    },
    "cycle_history_jsonl": {
      "url": "https://metal.freedom-yield.com/api/cycle-history.jsonl",
      "schema_url": "https://metal.freedom-yield.com/api/cycle-history.example.jsonl",
      "formal_schema_url": "https://metal.freedom-yield.com/api/cycle-history.schema.v1.json",
      "format_guide_url": "https://github.com/freedomyield/metal.freedom-yield.com/blob/main/docs/CYCLE_HISTORY.md"
    },
    "anchor_receipt": {
      "url": "https://metal.freedom-yield.com/api/anchor-receipt.json",
      "schema_url": "https://metal.freedom-yield.com/api/anchor-receipt.v2.example.json",
      "formal_schema_url": "https://metal.freedom-yield.com/api/anchor-receipt.schema.v2.json",
      "format_guide_url": "https://github.com/freedomyield/metal.freedom-yield.com/blob/main/docs/IDENTITY_VERIFICATION.md",
      "operator_guide_url": "https://github.com/freedomyield/metal.freedom-yield.com/blob/main/docs/PHASE_ALPHA_AUDIT_HANDOFF.md",
      "cross_reference_url": "https://metal.freedom-yield.com/api/anchor-source.json"
    },
    "anchor_history": {
      "url": "https://metal.freedom-yield.com/api/anchor-history.jsonl",
      "schema_url": "https://metal.freedom-yield.com/api/anchor-history.example.jsonl",
      "formal_schema_url": "https://metal.freedom-yield.com/api/anchor-history.schema.v2.json",
      "format_guide_url": "https://github.com/freedomyield/metal.freedom-yield.com/blob/main/docs/IDENTITY_VERIFICATION.md",
      "operator_guide_url": "https://github.com/freedomyield/metal.freedom-yield.com/blob/main/docs/PHASE_ALPHA_AUDIT_HANDOFF.md",
      "cross_reference_url": "https://metal.freedom-yield.com/api/anchor-receipt.json"
    }
  },
  "in_preparation_artifacts": {},
  "explorer_url": "https://explorer.metalblockchain.org/",
  "generated_at": "1970-01-01T00:00:00Z",
  "validator_state_observed_at": "1970-01-01T00:00:00Z",
  "stale_input_warning": false
}
